{
  "id": "defaut",
  "label": "d√©faut",
  "description": "",
  "layerScale": {
    "minScale": 20000000,
    "maxScale": 0
  },
  "labelScale": {
    "minScale": null,
    "maxScale": null
  },
  "style": {
    "fill": {
      "opacity": 0
    },
    "stroke": {
      "color": "#8fb583",
      "opacity": 1,
      "widthPx": 1.51
    },
    "hatch": {
      "enabled": true,
      "type": "diagonal",
      "angleDeg": 45,
      "spacingPx": 10,
      "stroke": {
        "color": "#94d180",
        "opacity": 1,
        "widthPx": 1
      },
      "renderMode": "pattern_only"
    }
  },
  "legend": {
    "label": "zones de conservation wdpa"
  }
}
