{
  "id": "population",
  "label": {
    "enabled": true,
    "visibleByDefault": false,
    "field": "ville",
    "font": {
      "family": "Lucida Sans",
      "sizePt": 7,
      "weight": 50,
      "bold": false,
      "italic": false
    },
    "color": "#323232",
    "opacity": 1,
    "buffer": {
      "enabled": true,
      "color": "#fafafa",
      "opacity": 1,
      "sizePx": 3.78
    },
    "background": {
      "enabled": false
    },
    "offset": {
      "distancePx": 0
    }
  },
  "description": "",
  "layerScale": {
    "minScale": 8000000,
    "maxScale": 10000
  },
  "labelScale": {
    "minScale": 3600000,
    "maxScale": 1000
  },
  "style": {
    "shape": "circle",
    "sizePx": 3.78,
    "fill": {
      "color": "#d70000",
      "opacity": 1
    },
    "stroke": {
      "color": "#ffffff",
      "opacity": 1,
      "widthPx": 1.32
    }
  },
  "legend": {
    "label": "Villes principales"
  }
}
